comment_id,video_id,author,text,like_count,published_at,updated_at,reply_count
UgyVa6yahhy3wfqw1IB4AaABAg,HeWFEeeUn00,@kaiooo-_-1383,W jid,0,2026-05-10T03:27:21Z,2026-05-10T03:27:21Z,0
Ugw_hKI4hv_fWXcbo7x4AaABAg,HeWFEeeUn00,@ozalot6813,"I’m confused, is Hullo out on bail or still arrested?",0,2026-05-10T03:26:48Z,2026-05-10T03:26:48Z,0
UgzVMHyK3G0k4cCNfH14AaABAg,HeWFEeeUn00,@matthewchristopher1125,"Jidion, you always look uncomfortable sitting in that chair😂",4,2026-05-10T03:24:03Z,2026-05-10T03:24:03Z,0
UgxKgYt_wcIAMlmocBp4AaABAg,HeWFEeeUn00,@asap_salazar8800,You are a goat for that protect the kids  from pedos,0,2026-05-10T03:23:05Z,2026-05-10T03:23:34Z,0
Ugy-hKD-_jBA0L1dnOt4AaABAg,HeWFEeeUn00,@sunnycoasttruckspotter,It’s so stupid that people are defending the pred like I understand the David situation because they don’t want to believe that he did something bad but this is a goddanm looksmaxer like there is no connection to a guy who makes his jaw look good,0,2026-05-10T03:21:25Z,2026-05-10T03:21:25Z,0
UgxbrWh2KoaAOyrzmm94AaABAg,HeWFEeeUn00,@r3cnsniper545,lol you shouldn’t be surprised Florida makes laws as they go can’t record cops breaking laws,0,2026-05-10T03:20:25Z,2026-05-10T03:20:41Z,0
UgwYoo-yqnn3l6BgX6p4AaABAg,HeWFEeeUn00,@weknowhisvoice9296,"❤❤Friends, seek the Lord Jesus Christ with sincerity. He gave His life for our sins and rose again so that we may receive eternal life. Repent and turn away from sin, believe the Gospel, be baptized, and walk in the teachings of Christ found in the four Gospels within His holy Church. Our Lord Jesus Christ alone is the way to salvation, and through faith He helps His people live in holiness and truth. In the name of the Father, and of the Son, and of the Holy Spirit. God bless you ✚ I personally recommend looking into the Oriental Orthodox Church.🎉🎉",0,2026-05-10T03:19:53Z,2026-05-10T03:19:53Z,0
Ugzw4kTyFsDf6YZ3yGp4AaABAg,HeWFEeeUn00,@RonBlackmanMicroPenis,why does jid-monkeyon keep getting bigger ?,0,2026-05-10T03:19:08Z,2026-05-10T03:19:08Z,0
Ugz5YGuYO3A2ZR5YSJd4AaABAg,HeWFEeeUn00,@RockyRiordanV,why u take down ur recent TikTok,0,2026-05-10T03:16:38Z,2026-05-10T03:16:38Z,0
UgwE4btBKY9Ghi4l2654AaABAg,HeWFEeeUn00,@wcmwfab935,Lol he is not a bad guy made some confusion.  Still to many protect preds.,0,2026-05-10T03:16:38Z,2026-05-10T03:16:38Z,0
Ugzw3A9nGOg1-HcGo7Z4AaABAg,HeWFEeeUn00,@tythrutime,Bros cheesing so hard 🤣🤣🤣 made my year,0,2026-05-10T03:15:53Z,2026-05-10T03:15:53Z,0
UgyuUDkiXEPblHPcTQ14AaABAg,HeWFEeeUn00,@xuanphamehe,"This man dares to have Christ tattooed on his chest as he proudly does something as horrendous as this. 
Shame on him.",0,2026-05-10T03:15:41Z,2026-05-10T03:15:41Z,0
UgymnVjJu6uKt7PwvOd4AaABAg,HeWFEeeUn00,@scottnelson176,Pizza ad at the end?!,0,2026-05-10T03:14:57Z,2026-05-10T03:14:57Z,0
UgzzOY2oWSKJrMT4cQl4AaABAg,HeWFEeeUn00,@Xenu88,My 2 sisters when to the store today and my younger sister I won’t say her age but 6th grade got asked by a worker at the store for her instagram and said some discusting to her and when she said I don’t talk to strangers he says I’m not a stranger. When I heard about this I went straight there and had my older sister point him out and I let him and the entire store know how disgusting he is and I talked to the manager and he started crying and shaking. He is lucky I am a changed man thank you jid for helping me find god,36,2026-05-10T03:13:51Z,2026-05-10T03:13:51Z,2
UgxgVdjW9FbMFFEPvlV4AaABAg,HeWFEeeUn00,@renatastone5479,"Wow idiots,ppl still defend him",0,2026-05-10T03:13:23Z,2026-05-10T03:13:23Z,0
UgzZo7KKE1b1T1iugux4AaABAg,HeWFEeeUn00,@Goodenough_media,Lmao ima be sure to add “”I know”” before typing “he’s not a bad guy so people know I’m being ironic 😂😂,0,2026-05-10T03:12:53Z,2026-05-10T03:12:53Z,0
Ugwz6TDGtQ-QExa5FHB4AaABAg,HeWFEeeUn00,@weegeeweeg,Free leafy,0,2026-05-10T03:12:39Z,2026-05-10T03:12:39Z,1
Ugxxl83WHXH6P-Mh0fl4AaABAg,HeWFEeeUn00,@vickiewallace415,Thank you sir for keeping us informed!!,2,2026-05-10T03:12:29Z,2026-05-10T03:12:29Z,0
UgxirAOLU1pyPucVSyl4AaABAg,HeWFEeeUn00,@SomethingGamecatAdjacent,jidion reacting to charlie reacting to jidion reacting to jidions pred catch,0,2026-05-10T03:11:59Z,2026-05-10T03:11:59Z,0
Ugzf39qpegfD00F6frZ4AaABAg,HeWFEeeUn00,@poisenbery,"Thanks for including a link to the OG video!
Now I know you're not piggybacking on his content for more views.
Oh wait.....you didn't....
Nevermind then.",0,2026-05-10T03:10:55Z,2026-05-10T03:10:55Z,0
UgxM08iRa1n84cNEm8t4AaABAg,HeWFEeeUn00,@alexisrivas307,Charlie’s video brought me here.,0,2026-05-10T03:09:50Z,2026-05-10T03:09:50Z,0
UgzjjnV8rxa4dyu_YHh4AaABAg,HeWFEeeUn00,@MOHAWKRIS8,The community of these people is Real! Influencers they are not! Thats on you! They are just people on the internet Being real Batman!,2,2026-05-10T03:09:44Z,2026-05-10T03:09:44Z,0
UgwW7twDNQ1LOZnLBNx4AaABAg,HeWFEeeUn00,@FelixElGato22R,Home boi gooning 🤣,0,2026-05-10T03:09:19Z,2026-05-10T03:09:19Z,0
Ugwyv52rpx3aBqBquA94AaABAg,HeWFEeeUn00,@wcmwfab935,Shtty app is probably a pred hub,0,2026-05-10T03:08:59Z,2026-05-10T03:08:59Z,0
UgyBu7aJc6QEBEOFCdt4AaABAg,HeWFEeeUn00,@ChanceOfMeatballz,"its like the girls that defend mass killers because they're attractive. it doesnt matter how good he looks, a pred is a pred, enough said.",0,2026-05-10T03:08:43Z,2026-05-10T03:08:43Z,0
UgymY2nCUf1nmcDUrkZ4AaABAg,HeWFEeeUn00,@luckyluciano8590,charlie + jidion + skeeter collab??,0,2026-05-10T03:06:29Z,2026-05-10T03:06:29Z,0
UgyDEnD8wqJPUa5lPvt4AaABAg,HeWFEeeUn00,@sluggerbutter,jid i love u dawg but why’d u gotta click bait like that,0,2026-05-10T03:04:47Z,2026-05-10T03:04:47Z,0
UgybefZ2H7Aszldf6gF4AaABAg,HeWFEeeUn00,@Bibby-r2r,"i have a lot of cp




in re9",0,2026-05-10T03:02:55Z,2026-05-10T03:02:55Z,0
Ugwcq1r9D-qtqv9gxFt4AaABAg,HeWFEeeUn00,@anonymousblaqguy,"Charlie is one of my favorite YouTubers too bruh.

Hard for me to put anybody above Acevane or Deleted Villain. But the pred catcher community is by far doing the most important work online.

Keep pushing.",0,2026-05-10T03:02:38Z,2026-05-10T03:02:38Z,0
UgyOQaToqrHvNVXRATZ4AaABAg,HeWFEeeUn00,@brianwilcox1686,"Please please tell me you want to nova’s house or at least recorded the phone call, you know new leaks came out and it’s bad like the fbi and shit I pray someone sent you it",0,2026-05-10T03:01:46Z,2026-05-10T03:01:46Z,0
UgwcpfD8t-UulXNpY0p4AaABAg,HeWFEeeUn00,@ber2coldx788,17:39 you found the “trump” now you have to find the “Epstein” Epsteins the nest,0,2026-05-10T03:00:29Z,2026-05-10T03:00:29Z,0
UgzoqEmrRcwQ0hmrTk14AaABAg,HeWFEeeUn00,@geraldgarcia3207,All of his fans are predators just like him that’s why they protect a predator,0,2026-05-10T03:00:19Z,2026-05-10T03:00:19Z,0
UgyHPSVQgU2NUr_BOcl4AaABAg,HeWFEeeUn00,@IvanVanko-b1y,I could see meatcanyon turning this into a video 🥲🥲,0,2026-05-10T02:59:41Z,2026-05-10T02:59:41Z,0
UgzcX76b-0MCSIKbM614AaABAg,HeWFEeeUn00,@zer0vr665,im pretty sure its js a vid abt the looksmaxer,0,2026-05-10T02:58:35Z,2026-05-10T02:58:35Z,0
Ugx3DXygV5WN5eZYBKF4AaABAg,HeWFEeeUn00,@TheMynameisyourface,6arakin video when 6arakin video when 6arakin video when,0,2026-05-10T02:58:21Z,2026-05-10T02:58:21Z,0
UgzrRgYJhuPzFDWhNDt4AaABAg,HeWFEeeUn00,@ber2coldx788,15:12 HES NOT A BAD GUY HAS ME WEEEEAK!!! 😂😂😂 jid why would you say he’s not a bad guy,0,2026-05-10T02:57:32Z,2026-05-10T02:57:32Z,0
Ugx7Ya0uhz6NyM2gfZh4AaABAg,HeWFEeeUn00,@C0nkeringS0uLz,"Hey Jidion, Florida cops are lying to you, THEY DO have body cams, they just don't want you having access to them.",1,2026-05-10T02:57:30Z,2026-05-10T02:57:30Z,1
UgwZtGxCdDa88mSnL0d4AaABAg,HeWFEeeUn00,@phillipondeez9809,Don’t get too excited Charlie just grasps onto anything that’s super viral,1,2026-05-10T02:56:32Z,2026-05-10T02:56:32Z,0
UgyPgmlgq6x156-so114AaABAg,HeWFEeeUn00,@SpyderAbaddon,"I’ve been watching you for years and even more recently with the predator catchers.

I have a serious question. Sometimes you catch predators with CP. You viewed this. How do you legally handle that? And doesn’t this legally make you in possession?",1,2026-05-10T02:56:17Z,2026-05-10T02:56:17Z,0
UgyP-nJFtKb_ddhCP8l4AaABAg,HeWFEeeUn00,@PotatoNATO123,now moist has to react to jidion reacting to moistcritical vid,0,2026-05-10T02:55:34Z,2026-05-10T02:55:34Z,0
UgwaqvpJ164tiZBmCwx4AaABAg,HeWFEeeUn00,@usernamevfh,Jidion pls make a video talking about the disney cruise ship,2,2026-05-10T02:55:32Z,2026-05-10T02:55:32Z,0
UgwfccsJCa8O0AmLn8h4AaABAg,HeWFEeeUn00,@AlexanderC08,good shit bro,258,2026-05-10T02:55:17Z,2026-05-10T02:55:17Z,16
Ugxiy10Z5rKFJcG-MJZ4AaABAg,HeWFEeeUn00,@Stay-143RiZz,My two favorite youtubers 😭w vid  🔥🔥🔥🔥🔥,2,2026-05-10T02:54:45Z,2026-05-10T02:54:45Z,0
UgwEObOrePVpfLhepPZ4AaABAg,HeWFEeeUn00,@J9inex,2 of my favorite YouTubers rn coming together let’s goooo🔥,0,2026-05-10T02:54:34Z,2026-05-10T02:54:34Z,0
UgwQIBOr7ifIxqiGkj94AaABAg,HeWFEeeUn00,@tzvicohen9844,love the tzitzit man❤❤,0,2026-05-10T02:52:43Z,2026-05-10T02:52:43Z,0
Ugzwm_Qufp1FelBsxwl4AaABAg,HeWFEeeUn00,@kuze2474,"You dont have to search for CP . It literally is just there. Ive seen it on X.
Ive reported at least 20 pics/videos. 
They may of been of age but to me they look underage. If it looks like CP than it is likely CP.
*this excludes hentai/lolicon. Both legal .",1,2026-05-10T02:51:49Z,2026-05-10T02:51:49Z,2
Ugz85S72o9a7iw6oUul4AaABAg,HeWFEeeUn00,@ActiveSpindle,Yep you know there's no turning back once moist critical covers someone. Glad that TikToker will be locked away.,0,2026-05-10T02:51:48Z,2026-05-10T02:51:48Z,0
UgyvQLpK7F-3-pmI5xV4AaABAg,HeWFEeeUn00,@c_orvus,as a floridian ik for a fact we have body cams on all of our officers idk why they lied to you but they did 😭,0,2026-05-10T02:51:22Z,2026-05-10T02:51:22Z,0
Ugw_l8D2CyHjGTbem_N4AaABAg,HeWFEeeUn00,@noximili3n,1:36 goadking thinking he slick,0,2026-05-10T02:48:40Z,2026-05-10T02:48:40Z,0
Ugzm3qnWYYr-FBiqxkJ4AaABAg,HeWFEeeUn00,@BasedPigBenis,"Thank you for what you do but 
6:07 not everything needs context, stop telling the Internet how you conduct business. You're letting the preds know how to not be interrogated as thorough. Just My opinion so forgive me but keep the  secret sauce to you and fellow catchers.",2,2026-05-10T02:46:41Z,2026-05-10T02:46:41Z,1
UgwAUD4h0Q4qRP1kAwl4AaABAg,HeWFEeeUn00,@randomness9608,Jidion doing gods work,0,2026-05-10T02:45:15Z,2026-05-10T02:45:15Z,0
UgyHMD12q_5xalJ6Wgl4AaABAg,HeWFEeeUn00,@Knight_of_NI,( ͡~ ͜ʖ ͡°) FAFO “WOODCHIPPER” Edition! There is no cure for DIAPER SNIPERS! 🤬🤦🏻‍♂️🤬,1,2026-05-10T02:43:47Z,2026-05-10T02:43:47Z,0
UgzbKQ2j1odsPWRiH6h4AaABAg,HeWFEeeUn00,@nilehoruseus,You 2 gotta collab,0,2026-05-10T02:41:50Z,2026-05-10T02:41:50Z,0
UgzYV3mGFUUTmLm_r-x4AaABAg,HeWFEeeUn00,@brando62329,"You want to speak with Jidion: 🌝

Jidion wants to speak with you: 🌚",75,2026-05-10T02:41:50Z,2026-05-10T02:41:50Z,0
UgymzCvr1xaa94sJRxd4AaABAg,HeWFEeeUn00,@july24pictures,Charlie is not a bad guy,1,2026-05-10T02:40:33Z,2026-05-10T02:40:33Z,0
UgzOZpn7Q-cPa6oetlB4AaABAg,HeWFEeeUn00,@naeemspage,25 max... Nonsense,0,2026-05-10T02:40:05Z,2026-05-10T02:40:05Z,0
Ugzz8IZJUw94zCbT1N14AaABAg,HeWFEeeUn00,@Commanderdoomiscool,Yooo great that you got on moist’s vids bruh love your stuff bruh,0,2026-05-10T02:38:07Z,2026-05-10T02:38:07Z,0
UgyhSYBjA9F_pNjpMXh4AaABAg,HeWFEeeUn00,@Marco24O,PEOPLE ARE STILL DEFENDING HULU BRO?!?!?!?!?!?! I DONT respect the hell out of that…🤦🏽,0,2026-05-10T02:36:14Z,2026-05-10T02:36:14Z,0
Ugxo_YTdbNWav1EkSXF4AaABAg,HeWFEeeUn00,@negresco2946,Jidion my damn goat✌️,0,2026-05-10T02:34:53Z,2026-05-10T02:34:53Z,0
UgwSvPwM9QX0NO4gKZZ4AaABAg,HeWFEeeUn00,@thiccfucka69xxx,Seeing a massive YouTuber fanboying hardcore over being in a Charlie video is so adorable,0,2026-05-10T02:34:00Z,2026-05-10T02:34:00Z,0
UgxiyMK2wGksjNugtV94AaABAg,HeWFEeeUn00,@bluesky5384,I always feel like you're right leaning and he's hugely left leaning yet I watch you both and love that you support one another. Good character transcends political BS,0,2026-05-10T02:32:40Z,2026-05-10T02:32:57Z,1
UgyXa-1qUGn5ipbZZ3d4AaABAg,HeWFEeeUn00,@randyranderson-i3x,typical maga behavior,0,2026-05-10T02:32:14Z,2026-05-10T02:32:14Z,0
UgxbZ7d6E31VoU6Nb1l4AaABAg,HeWFEeeUn00,@GoblinAndTrollBridge,"EDP is 1 letter away from 


P
E
D
O",0,2026-05-10T02:29:03Z,2026-05-10T02:29:03Z,2
Ugy0liYVGUcAybJw53t4AaABAg,HeWFEeeUn00,@speedyd72,Bro you should just make another channel called “Jidion reacts” at this point 🤷🏽🦾,1,2026-05-10T02:28:30Z,2026-05-10T02:28:56Z,0
UgwD0HHVAmTrWwlBNO14AaABAg,HeWFEeeUn00,@LamarEedy,11:25 faceiq???,1,2026-05-10T02:28:26Z,2026-05-10T02:28:26Z,0
UgwN8-vt8j_djtDOjHN4AaABAg,HeWFEeeUn00,@DavidWilliams-iz7wf,Yo jidion there's a edp in my town who's still out and Abt and hasn't been punished for anything he's done I can give you more details just lmk,0,2026-05-10T02:28:25Z,2026-05-10T02:28:25Z,0
UgwD9Qy9qQ5tBsKqmDl4AaABAg,HeWFEeeUn00,@_nugz_6947,That’s how you KNOW you made it 🕺🏿,0,2026-05-10T02:27:30Z,2026-05-10T02:27:30Z,0
Ugy4d1r0iq705GnUWkR4AaABAg,HeWFEeeUn00,@D0ozycg,Being praised by charlie is one of the biggest accomplishments for a YouTuber,23,2026-05-10T02:26:43Z,2026-05-10T02:26:43Z,0
UgyBozb8oIu13t84me54AaABAg,HeWFEeeUn00,@sowsowyt,Jidion reacting to Moist critical reaction to jidion,0,2026-05-10T02:26:05Z,2026-05-10T02:26:05Z,0
UgzRrzxtbgT1nQxjDYB4AaABAg,HeWFEeeUn00,@gamer2021,You know why florida doesn't have body cams,1,2026-05-10T02:26:01Z,2026-05-10T02:26:01Z,1
Ugz7nc-NPrFg1t-5vGd4AaABAg,HeWFEeeUn00,@Mkaythen,MOISTMAXXING!!!,1,2026-05-10T02:23:51Z,2026-05-10T02:23:51Z,0
UgyW_P8sVTsdnClA4KN4AaABAg,HeWFEeeUn00,@ginnmann,"cant stop looking at the person posting ""im gay"" in the chat consistently",0,2026-05-10T02:22:30Z,2026-05-10T02:22:30Z,0
Ugxvg-yNQ49uVJ7SMyh4AaABAg,HeWFEeeUn00,@mayo9738,I saw the comment in the original video,0,2026-05-10T02:21:34Z,2026-05-10T02:21:34Z,0
UgwxPTMTLnIRX4cw7YV4AaABAg,HeWFEeeUn00,@G0LD_Star-LionMark,Jidion has been my favorite content creator as of lately and I’m very happy to see him use his platform to create awareness of the freaks out in the world and bring justice is a beautiful thing honestly.,0,2026-05-10T02:21:25Z,2026-05-10T02:21:25Z,0
UgxTA63-7aTvnOyiAg14AaABAg,HeWFEeeUn00,@Akamaruu1987,Time to go after Nova Online Jideon,1,2026-05-10T02:21:04Z,2026-05-10T02:21:04Z,0
UgxDlKuVcv6gwowt_h94AaABAg,HeWFEeeUn00,@Shifted-to-Shape,Charlie is a great content creator.,7,2026-05-10T02:20:11Z,2026-05-10T02:20:11Z,1
UgzuYfqGScZu1ba3wPF4AaABAg,HeWFEeeUn00,@certifiedcib7958,I KNEW “he’s not a bad guy” was gonna have this result 😂😂😂,0,2026-05-10T02:19:03Z,2026-05-10T02:19:03Z,0
Ugwg8vriYQ-n_VIxirR4AaABAg,HeWFEeeUn00,@BLOODY__FATALITY,"6:25
Translation: ""MOMMA WE MADE IT!!!!!!!!!!!!! I'M IN A PREDATOR'S VIDEO!!!!!!!!!!!!!!!!""

Mo1stCritical is a self admitted predator that said sex transitioning your kids is okay and a good thing to do. Good job clapping about that though Jid. :/",2,2026-05-10T02:18:20Z,2026-05-10T02:18:20Z,7
UgypNQCrk4PoS5nKoYV4AaABAg,HeWFEeeUn00,@AsoAshoto,2:46 that's a county to county thing I think.   I don't see enough officers so confirm 😅,1,2026-05-10T02:18:13Z,2026-05-10T02:18:13Z,0
UgydUR9kuwqgHAW2QLR4AaABAg,HeWFEeeUn00,@EliteBraixen,Are we getting nova or nah,0,2026-05-10T02:17:41Z,2026-05-10T02:17:41Z,0
Ugwxoa6cy8WsbuC_YoB4AaABAg,HeWFEeeUn00,@boblobz12,all fun and games until jayoma is the defence lawyer,0,2026-05-10T02:17:23Z,2026-05-10T02:17:23Z,0
UgxyL0oPv9jm6Oxyach4AaABAg,HeWFEeeUn00,@jjdelany8130,Maybe don't tell everyone why you ask questions to prove intent,0,2026-05-10T02:17:19Z,2026-05-10T02:17:19Z,0
UgyjXhH1HvXl7JeQs994AaABAg,HeWFEeeUn00,@Zakallisonmma,Always yelling man always gotta keep volume on barely any,1,2026-05-10T02:15:49Z,2026-05-10T02:15:49Z,0
Ugy6C_YASKweVbLPfDp4AaABAg,HeWFEeeUn00,@fwnative-o8m,"Love u bro, keep up the good work ❤",0,2026-05-10T02:13:57Z,2026-05-10T02:13:57Z,0
UgxDYtvsqDPsfrz5Wlp4AaABAg,HeWFEeeUn00,@RealCashter,Have Charlie catch edp445 with you guys a third time,0,2026-05-10T02:13:18Z,2026-05-10T02:13:18Z,0
Ugwum4gAYLq0ZpszDaN4AaABAg,HeWFEeeUn00,@MarcoThePHX,W tho,0,2026-05-10T02:12:23Z,2026-05-10T02:12:23Z,0
UgzMc4ujKutARiBrdHZ4AaABAg,HeWFEeeUn00,@BLOODY__FATALITY,"Title translation:
A pred catch has been watched by a pred.

Idk why people forget he is a openly admitted pred. He said he was okay with people transitioning kids. The fact that you are saying he is your favorite is very telling unless this is sarcasm cause you sure have me fooled right now.",1,2026-05-10T02:12:11Z,2026-05-10T02:12:11Z,3
UgwCZ5Lf40t0w1Mdn7x4AaABAg,HeWFEeeUn00,@Bewcannonz,X has a serious CP problem right now. The amount of times in the last month I’ve seen pages basically post ads selling this stuff is troubling and Elon seems to be doing noting about it.,5,2026-05-10T02:11:44Z,2026-05-10T02:11:44Z,1
UgwZE1BgDn-00RX0Qb94AaABAg,HeWFEeeUn00,@megakoopa-pokemonandmore6152,"Jidion, Skeet, Trilogy Media, Courtney and Charlie all need to do a predator catch together",0,2026-05-10T02:11:14Z,2026-05-10T02:11:14Z,2
UgwQtMMzoJXxNj4fFnd4AaABAg,HeWFEeeUn00,@TURTLEBUSTERS,Why are you explaining? Now the preds gonna say they didnt have intent. Great. :l,0,2026-05-10T02:11:13Z,2026-05-10T02:11:13Z,0
UgxdXqM820CecTr7QsN4AaABAg,HeWFEeeUn00,@AyTt-so9ey,jidion more famous than moist overseas,0,2026-05-10T02:10:22Z,2026-05-10T02:10:22Z,0
UgyXw-gOfyO2EBZgokp4AaABAg,HeWFEeeUn00,@datura_boof,Mostcritikal is so wrong saying that about catchers. That's not true about Alex Rosen and jidion,0,2026-05-10T02:10:19Z,2026-05-10T02:10:19Z,0
UgzZ_WVv2QAGjFFMtvZ4AaABAg,HeWFEeeUn00,@infrastructure-forward,Do a video with Face IQ!,0,2026-05-10T02:09:04Z,2026-05-10T02:09:04Z,0
Ugx6wFhnj5WfgJt2LXZ4AaABAg,HeWFEeeUn00,@JoeyTheMinion,"Wasn’t Jidion already featured in another Moist crtikal video?
The one where him and Charlie talked about his attempted catch against EDP",14,2026-05-10T02:08:40Z,2026-05-10T02:11:17Z,2
UgwRO2TWqlYJ09eUKXB4AaABAg,HeWFEeeUn00,@chrisjamesbrian,"Cmon dude…
You know EXACTLY why Florida doesn’t have body cams.

If you want to earn respect, you have to call a spade a spade.",2,2026-05-10T02:08:16Z,2026-05-10T02:08:16Z,4
Ugx0mxUGFTR_hwNgCQZ4AaABAg,HeWFEeeUn00,@Jay19958,I'm gonna be real I came across Jidion doing this stuff from Matan Evens just trolling him and now I am binging all his videos and loving his content. Just a weird place to get introduced to him I am sure because it's like the least serious context ever 😂,0,2026-05-10T02:08:13Z,2026-05-10T02:08:13Z,0
UgzuiS7JpTjpbfUSvgV4AaABAg,HeWFEeeUn00,@datura_boof,"Florida def has body cams on patrol cops you silly goon, but detectives usually don't at most departments and it was like wayyy likely he was taken in by detectives you silly goose. Don't make it sound like Sarasota police don't have body cams because you're basically just spreading misinformation",0,2026-05-10T02:08:12Z,2026-05-10T02:08:12Z,0
UgwKrde9BQCg8zAW3d94AaABAg,HeWFEeeUn00,@froopty1854,Hullo is now prison maxxing,0,2026-05-10T02:07:06Z,2026-05-10T02:07:06Z,0
UgySw8Jj5P1RYMzvcxl4AaABAg,HeWFEeeUn00,@MB18916,Bro what the fuck. Masons we need to step up. I swear not all of us are pdfs or weirdos 😔🙏,0,2026-05-10T02:06:55Z,2026-05-10T02:06:55Z,0
Ugwzn0pEpoLU-8sck6p4AaABAg,HeWFEeeUn00,@bassman0704,I'm happy you got this monster in prison. Congratulations!,0,2026-05-10T02:06:47Z,2026-05-10T02:06:47Z,0
UgxF0x2gHgrpBMrhbeh4AaABAg,HeWFEeeUn00,@Darthrights,Hullo got mogfed,0,2026-05-10T02:05:27Z,2026-05-10T02:05:27Z,0
UgyD-_NZzkO0dXinZGB4AaABAg,HeWFEeeUn00,@alaishaburrell142,"I haven’t watched the video yet, but I want to say something real quick.  I’m not trying to glaze or protect Jidion I don’t even know this dude but can we all agree on something? Why do people care if he’s making money off literally child predators?? Let’s just say he was in it for the money…so?? He’s taking these predators/Rapists and putting them in bars while making money on the side? How many people do you know in our legal system that cares about our children because if they did trust me these pedos wouldn’t be this careless. The money Jidion uses is the same money that helps him go to state to state and even one time out the country?? Do you know how expensive that is and he’s doing it in every video? Now, I am going to watch this video and I’m going to guess that they upset or concerned that he’s using his platform to make profit off pedos. I better be wrong.",1,2026-05-10T02:04:15Z,2026-05-10T02:12:24Z,0
UgwpWABSBJeY0bUCtQ94AaABAg,HeWFEeeUn00,@origamiswann,"Personally, I feel like Charlie can be spineless on opinions and virtue signal too much some times. But still hella cool to see him spread the word.",1,2026-05-10T02:04:06Z,2026-05-10T02:04:06Z,0
Ugx7gWsQmlx5k0tgKXR4AaABAg,HeWFEeeUn00,@vapreom,you made ir,0,2026-05-10T02:03:31Z,2026-05-10T02:03:31Z,0
UgyTBJ3S4zqlQWH8opZ4AaABAg,HeWFEeeUn00,@Beenssa,You should try to do a catch with him,0,2026-05-10T02:03:24Z,2026-05-10T02:03:24Z,0
Ugy38ZWMdx3QSExGZlF4AaABAg,HeWFEeeUn00,@xx_The_Homelander_xx,Omg it'd be an honor to be positively featured in a Charlie video! Congrats man!,0,2026-05-10T02:02:18Z,2026-05-10T02:02:18Z,0
Ugy0258C9aNKfxBKj2l4AaABAg,HeWFEeeUn00,@kohenemoore,You really acting like you ain't get it out the mudd twice?! You did that twice. By choice!,0,2026-05-10T02:02:05Z,2026-05-10T02:02:05Z,0
UgxhCN9nQbVSfhPU_th4AaABAg,HeWFEeeUn00,@edueloso,Yooo I'm a big fan of bothhh ♥️ should make a collab,0,2026-05-10T02:02:03Z,2026-05-10T02:02:03Z,0
Ugwf7SE_xFhMB7lZVRd4AaABAg,HeWFEeeUn00,@ygchampo,Jidion finally made it😂,0,2026-05-10T02:01:39Z,2026-05-10T02:01:39Z,0
UgwSy1bz-MV14jLWZU94AaABAg,HeWFEeeUn00,@fleshtaffy,"My man milking this as much as he can haha another commentary. No offense, but as someone who doesn't watch streamers, I just want to see the damn catch!",1,2026-05-10T02:01:21Z,2026-05-10T02:01:21Z,0
UgzeiDjT5A77dRLMLlJ4AaABAg,HeWFEeeUn00,@kconstructed,"Oh, prison will LOVE him 😏",0,2026-05-10T02:00:42Z,2026-05-10T02:00:42Z,0
Ugy_I6t65zR0809aR2Z4AaABAg,HeWFEeeUn00,@PETEYBOY954,Reach out to cheeky soap. Get us a cupcake scented bar called Just Desserts or Teen Spirit or something and tell them to donate half the rev to csam victim support organizations! That’s my 2 cents anyways. Keep up the good work!,479,2026-05-10T02:00:37Z,2026-05-10T02:00:37Z,30
UgxY_AOihnfRpfodrZN4AaABAg,HeWFEeeUn00,@deleepariyarathna1716,I disagree you have to be looking for these telegrams. I stumbled on them while looking bblue on twitter. I reported but I’m pretty sure it’s still up there.,0,2026-05-10T02:00:26Z,2026-05-10T02:00:26Z,0
UgzMG4Mx4jeXuzHfdBt4AaABAg,HeWFEeeUn00,@elijahdubois7902,YOOOOOOOO!!!!!! CONGRATS JIDION!,1,2026-05-10T01:59:46Z,2026-05-10T01:59:46Z,0
UgxWnLzws82hC6nFNEZ4AaABAg,HeWFEeeUn00,@varex.j,JIDIONNNNNNNNNNNNN WITH ANOTHER ONEEEEE,0,2026-05-10T01:59:29Z,2026-05-10T01:59:29Z,0
Ugx2eUOGU9BOEUVIvuV4AaABAg,HeWFEeeUn00,@hpugrad2001,Love you and Charlie!,0,2026-05-10T01:58:41Z,2026-05-10T01:58:41Z,0
UgyltjLSiY8xd7luBpl4AaABAg,HeWFEeeUn00,@HiddenFushiguro,"ah yes, the ""is _ worth it"" guy.",0,2026-05-10T01:58:28Z,2026-05-10T01:58:28Z,0
UgwKzwyLLfxkZoJZ1e14AaABAg,HeWFEeeUn00,@ryderrice7816,in fl bodycam are not legally required but you are aloud to buy your own to use which is why you will see some with a body cam and some without,7,2026-05-10T01:58:07Z,2026-05-10T01:58:07Z,1
UgxW6Yl7gTXy6Cx732h4AaABAg,HeWFEeeUn00,@Jacob2flyy2,We got em edp watch hulo is an edp 🤣,1,2026-05-10T01:57:46Z,2026-05-10T01:57:46Z,0
UgwehlhObbheDZICXjl4AaABAg,HeWFEeeUn00,@DEMONPOOKIE-v7w,W Jidion,0,2026-05-10T01:57:25Z,2026-05-10T01:57:25Z,0
UgzOcd-hQjyWf9m3y6x4AaABAg,HeWFEeeUn00,@sophiesheabutter,I love when my favorite internet people are friends,2,2026-05-10T01:57:00Z,2026-05-10T01:57:00Z,0
Ugx_uR7gQ9DV96GwVG94AaABAg,HeWFEeeUn00,@johnnylawrencesimp6969,😭,0,2026-05-10T01:56:28Z,2026-05-10T01:56:28Z,0
UgwN1ETPrUI958cV6Gp4AaABAg,HeWFEeeUn00,@truedelagirl,Jidion is so giddy bro!! But I’m glad that this is finally getting more attention.,0,2026-05-10T01:56:26Z,2026-05-10T01:56:26Z,0
UgzkKA8lGeM8WvbX_mF4AaABAg,HeWFEeeUn00,@juggalo-only420,Hell yeah!!! Let's fucking go!!!!,0,2026-05-10T01:55:53Z,2026-05-10T01:55:53Z,0
Ugw4A7gUCmav1p7PsMJ4AaABAg,HeWFEeeUn00,@anonymousxiii4780,Jidion congrats on making it.,0,2026-05-10T01:55:52Z,2026-05-10T01:55:52Z,0
UgwjmraoT4HOtxb0Lch4AaABAg,HeWFEeeUn00,@STEPHxCA,Hullo is abouta be JESTERING while getting MOGGED by all the real PRISONMAXXERS 😂😂😂😂😂,95,2026-05-10T01:55:40Z,2026-05-10T01:55:40Z,3
UgwUQ0eCqGPuQa7qlTF4AaABAg,HeWFEeeUn00,@setiajumpman,skipped charlie's vid bc i knew u would make this. huge,0,2026-05-10T01:55:39Z,2026-05-10T01:55:39Z,0
UgxB_7ELYp_EAAn_prN4AaABAg,HeWFEeeUn00,@jd01122,"I appreciate what you do. I really do, but why do you have to scream at the top of your lungs in all of your videos bro. Shit is so unpleasant.",0,2026-05-10T01:55:29Z,2026-05-10T01:56:29Z,0
UgxhHACwpJiMC5tLYbt4AaABAg,HeWFEeeUn00,@Bcjr55,Say Goodbye to College/Jobs,5,2026-05-10T01:54:16Z,2026-05-10T01:54:27Z,0
Ugyk1rrCzIL7JFjDsbN4AaABAg,HeWFEeeUn00,@Turfbaby831,I don’t give a damn what a yt man has to say! Everything they say are 90% lies 10% truth💯,0,2026-05-10T01:53:41Z,2026-05-10T01:53:41Z,0
UgzoDBhygRS_yGlWpb54AaABAg,HeWFEeeUn00,@JoBrologna,I need you to hunt down Nova. It’s been 7 days,0,2026-05-10T01:53:33Z,2026-05-10T01:53:33Z,0
UgyGiLHxNQQONh-LCOB4AaABAg,HeWFEeeUn00,@GrannEof3,he needs put under a jail !!,0,2026-05-10T01:53:15Z,2026-05-10T01:53:15Z,0
UgxA--E0B2ZMTnk32al4AaABAg,HeWFEeeUn00,@JoBrologna,"0:01 I’m telling you right now, if you slander Charlie I will unsubscribe and thumbs down every video you ever post",0,2026-05-10T01:52:19Z,2026-05-10T01:52:19Z,0
